{
  "artifact_id": "018f6f2a-7c4d-4a1b-8e21-1c9b57c84a11",
  "candidate_intent": {
    "activation": "operator-action-required",
    "candidate_version": "1",
    "completeness": "complete",
    "interfaces": [],
    "source_observation_fingerprint": "sha256:cf5cfe908280c477f6fa29d396fabdcb781c7508845e2d8ff4e342e35837cd5c",
    "status": "candidate-not-active"
  },
  "collection": {"consistency": "generation_validated_sequential", "finished_at": "2026-07-14T12:00:01Z", "overall_status": "complete", "started_at": "2026-07-14T12:00:00Z"},
  "compatibility": {"dual_emission": false, "profile3_artifact_reference": null},
  "declared_intent": null,
  "fingerprints": {
    "observation": {"algorithm": "https://tbom.yozi.systems/algorithms/edge-network-topology/4.0.0/observation-fingerprint-yozi-fp-v1-jcs-sha256", "availability": "available", "error_code": null, "reason_codes": [], "value": "sha256:cf5cfe908280c477f6fa29d396fabdcb781c7508845e2d8ff4e342e35837cd5c"},
    "topology": {"algorithm": "https://tbom.yozi.systems/algorithms/edge-network-topology/4.0.0/topology-fingerprint-yozi-fp-v1-jcs-sha256", "availability": "unavailable", "error_code": "https://tbom.yozi.systems/registries/edge-network/error-codes/1/structural-projection-unavailable", "reason_codes": ["https://tbom.yozi.systems/registries/edge-network/reason-codes/1/declared_intent_absent"], "value": null}
  },
  "generated_at": "2026-07-14T12:00:01Z",
  "host_identity": {"disclosure_scope": "local", "evidence": [], "identity_source_class": "generated-persistent", "instance_id": "b17d7437-2e3e-4c88-9bea-325fa075331e", "persistence": "persistent", "privacy_classification": "scope-correlatable", "reproducibility": "producer-local-not-independently-reproducible"},
  "identity_plane": {"nodes": []},
  "intent_conformance": {"reason_codes": ["https://tbom.yozi.systems/registries/edge-network/reason-codes/1/declared_intent_absent"], "status": "not-evaluated"},
  "intent_status": "absent",
  "observation": {
    "collection_consistency": "generation_validated_sequential",
    "conformance": [],
    "datasets": [{"attempts": 1, "dataset": "links", "namespace_key": "root", "reason_codes": [], "records_emitted": 0, "records_seen": 0, "status": "complete"}],
    "disclosure_profile_id": "https://tbom.yozi.systems/registries/edge-network/disclosure-profiles/1/structural-conformance",
    "interfaces": [],
    "neighbors": [],
    "projection_id": "https://tbom.yozi.systems/projections/edge-network-topology/4.0.0/observation",
    "routes": [],
    "structural_topology_fingerprint": null
  },
  "profile_id": "invaros.tbom.profile.edge_network_topology",
  "profile_version": "4.0.0",
  "schema_uri": "https://tbom.yozi.systems/schemas/edge-network-topology/4.0.0/schema.json",
  "specification_uri": "https://tbom.yozi.systems/specifications/edge-network-topology/4.0.0",
  "structural_topology": null
}
